{
  "$schema": "urn:openaix:schema:airway:0.1.0-draft.2",
  "airway_type": "airway",
  "id": "v356",
  "ident": "V356",
  "level": "low",
  "name": "Victor airway V356",
  "segments": [
    {
      "distance": {
        "unit": "nm",
        "value": 7.0
      },
      "fix": {
        "ident": "DBL",
        "position": {
          "latitude": 39.4393444444,
          "longitude": -106.8946805556
        }
      },
      "maximum_altitude": {
        "reference": "MSL",
        "unit": "ft",
        "value": 17500
      },
      "minimum_altitude": {
        "reference": "MSL",
        "unit": "ft",
        "value": 15200
      },
      "outbound_course": {
        "reference": "magnetic",
        "value": 45.8
      }
    },
    {
      "distance": {
        "unit": "nm",
        "value": 13.0
      },
      "fix": {
        "ident": "FISTR",
        "position": {
          "latitude": 39.5014638889,
          "longitude": -106.7671083333
        }
      },
      "inbound_course": {
        "reference": "magnetic",
        "value": 46.1
      },
      "maximum_altitude": {
        "reference": "MSL",
        "unit": "ft",
        "value": 17500
      },
      "minimum_altitude": {
        "reference": "MSL",
        "unit": "ft",
        "value": 15200
      },
      "outbound_course": {
        "reference": "magnetic",
        "value": 45.8
      }
    },
    {
      "fix": {
        "ident": "FIDLE",
        "position": {
          "latitude": 39.6163722222,
          "longitude": -106.5298166667
        }
      },
      "inbound_course": {
        "reference": "magnetic",
        "value": 46.1
      }
    },
    {
      "distance": {
        "unit": "nm",
        "value": 19.8
      },
      "fix": {
        "ident": "ELORE",
        "position": {
          "latitude": 39.8652027778,
          "longitude": -105.0501972222
        }
      },
      "inbound_course": {
        "reference": "magnetic",
        "value": 69.6
      },
      "maximum_altitude": {
        "reference": "MSL",
        "unit": "ft",
        "value": 17500
      },
      "minimum_altitude": {
        "reference": "MSL",
        "unit": "ft",
        "value": 7800
      },
      "outbound_course": {
        "reference": "magnetic",
        "value": 76.7
      }
    },
    {
      "fix": {
        "ident": "DVV",
        "position": {
          "latitude": 39.8946888889,
          "longitude": -104.6243361111
        }
      },
      "inbound_course": {
        "reference": "magnetic",
        "value": 77.0
      }
    }
  ],
  "source": "FAA CIFP cycle 2610",
  "type": "AIRWAY"
}
